Transcripciones/unipi.itindex.phpp/Pagina1.txt.csv;Beca proyecto inclinados;Italia;Maestria;Universidad de Pisa;Inclinados hacia America Latina es un proyecto creado para promover la Universidad de Pisa en el continente Latinoamericano, El proyecto preve la posibilidad de obtener una beca de estudio.;https://www.unipi.it/index.php/programas-hacia-america-latina/item/4021-estudiantes-de-america-latina-proyecto-inclinados
Transcripciones/computer.ing.unipi.itai/Pagina2.txt.csv;Laurea Magistrale (MSc) in Artificial Intelligence and Data Engineering ;Italia;Maestria;Universidad de Pisa;El MSc proporciona una solida educacion en profundidad que permite a los graduados disenar e implementar, por un lado, sistemas para administrar de manera eficiente una gran cantidad de datos y extraer conocimiento util de estos datos, y, por el otro, sistemas inteligentes mediante la explotacion de la inteligencia artificial;https://computer.ing.unipi.it/aide-lm
Transcripciones/unipi.itindex.phpl/Pagina3.txt.csv;Curso de grado en inteligencia artificial e ingenieria de datos;Italia;Maestria;Universidad de Pisa;El Programa de Maestria en Inteligencia Artificial e Ingenieria de Datos ofrece una formacion solida y profunda que permite a sus egresados disenar e implementar sistemas informaticos para gestionar de manera eficiente grandes cantidades de datos;https://www.unipi.it/index.php/lauree/corso/11227
Transcripciones/becas-sin-fronteras.com/Pagina4.txt.csv;Becas para Estudios Academicos de Posgrado e Investigacion;Argentina, Bolivia, Brasil, Canada, Costa Rica, entre otros;Maestria, Doctorado, Postdoctorado, Investigacion;Organizacion de los Estados Americanos (OEA);Las Becas para Estudios Academicos de Posgrado e Investigacion - OEA, 2021 son otorgadas para realizar estudios a tiempo completo en cualquier universidad de los Estados Miembros de la OEA, las becas no se otorgan para estudiar en el pais patrocinador del postulante, la modalidad de estudio es presencial, a distancia (en linea) o una combinacion de ambas. las becas se otorgan por un periodo minimo de un (1) ano y un maximo de dos (2) anos academicos.;https://becas-sin-fronteras.com/beca/becas-para-estudios-academicos-de-posgrado-e-investigacion-oea-a0401/
Transcripciones/becas-sin-fronteras.com/Pagina5.txt.csv;Becas academicas de estudios de pregrado OEA;Argentina, Bolivia, Brasil, Chile, Costa Rica, entre otros;Pregrado / Licenciatura;Organizacion de los Estados Americanos (OEA);Las Becas Academicas de la OEA para estudios de pregrado se otorgan para los dos ultimos anos academicos de una licenciatura a ciudadanos / residentes de un Estado Miembro de la OEA del Caribe angloparlante y Surinam. La modalidad de estudio es presencial, en linea o una combinacion de ambos. Las solicitudes de becas para estudios en linea se priorizaran en el momento de la seleccion.;https://becas-sin-fronteras.com/beca/becas-academicas-de-estudios-de-pregrado-oea-a1593/
Transcripciones/its.ac.idinternatio/Pagina6.txt.csv;Beca KNB;Indonesia;Maestria, Doctorado;Gobierno de Indonesia;La Beca Kemitraan Negara Berkembang, conocida popularmente como Beca KNB, es una ayuda financiera ofrecida por el gobierno de Indonesia para prospectar a estudiantes internacionales provenientes de paises en desarrollo para obtener su maestria en una de las universidades indonesias.;https://www.its.ac.id/international/experiencing-its/prospective-student/scholarship/knb/
Transcripciones/scholarships.uq.edu.au/Pagina7.txt.csv;Becas de estudios en la universidad de Queensland;Australia;Maestria, Doctorado, Posdoctorado, Investigacion;Universidad de Queensland;Se ofrecen muchas becas para determinadas disciplinas academicas. Estas becas pueden ser para estudiantes matriculados en un titulo, escuela o facultad especificos, o para estudiantes que estan investigando o estudiando un tema en particular.;https://scholarships.uq.edu.au/
Transcripciones/gist.ac.kriadmhtml/Pagina8.txt.csv;Becas GIST;Korea;Maestria, Doctorado;Gwangju Institute of Science and Technology;Esta beca ofrece soporte financiero en distintos campos para los estudiantes que apliquen a ellas;https://www.gist.ac.kr/iadm/html/sub04/04.html
Transcripciones/portal.icetex.gov.coPor/Pagina9.txt.csv;Estudios de Maestria o Doctorado en Taiwan;Taiwan;Maestria, Doctorado;Ministerio de Educacion (MOE) de la Republica de China (Taiwan);Ofrece la oportunidad a profesionales colombianos de realizar estudios de maestria o doctorado en Taiwan.;https://portal.icetex.gov.co/Portal/Home/HomeEstudiante/becas/becas-para-estudios-en-el-exterior/becas-vigentes/conv-estudios-maestria-doctorado-taiwan
Transcripciones/educations.comstudy/Pagina10.txt.csv;Maestria en Ciberseguridad;Barcelona;Maestria;Universitat Politecnica de Catalunya;El objetivo del master en Ciberseguridad es ofrecer a los estudiantes una solida base cientifica en el campo de la seguridad de las tecnologias de la informacion para dotar a la sociedad de profesionales altamente especializados en proteccion de datos, proteccion de infraestructuras y proteccion de aplicaciones.;https://www.educations.com/study-abroad/universitat-politecnica-de-catalunya/masters-degree-in-cybersecurity-1498694
Transcripciones/educations.comstudy/Pagina11.txt.csv;Maestria en Inteligencia Artificial;Barcelona;Maestria;Universitat Politecnica de Catalunya;Garantiza una educacion interdisciplinaria en la que la informatica se cruza con la filosofia, la psicologia, la linguistica, la ingenieria y otros campos. Se centra en la ingenieria del conocimiento, el aprendizaje automatico y los sistemas de agentes multiples, el procesamiento del lenguaje natural, el razonamiento y la resolucion de problemas, la informatica blanda y las tecnologias de IA, y la aplicacion de tecnicas de IA a la practica profesional.;https://www.educations.com/study-abroad/universitat-politecnica-de-catalunya/masters-degree-in-artificial-intelligence-1498690
Transcripciones/educations.comstudy/Pagina12.txt.csv;Maestria en Desarrollo de Juegos;Croacia;Maestria;Algebra University College;Busca que los estudiantes aprendan a desarrollar juegos en todas las plataformas y analizar las tendencias modernas y futuras para equipar mejor su conjunto de habilidades para estar en linea y por delante de la curva de desarrollo.;https://www.educations.com/study-abroad/algebra-university-college/master-in-game-development-801115
Transcripciones/educations.comstudy/Pagina13.txt.csv;Master interuniversitario en Ingenieria Computacional y Matematicas;Tarragona;Maestria;Universitat Rovira i Virgili;El Master online URV-UOC en Ingenieria Computacional y Matematica (ECiM) ofrece una formacion interdisciplinar en ingenieria y ciencias aplicadas. El programa ECiM incluye temas de vanguardia como modelado y simulacion por computadora, metodos numericos, computacion paralela y distribuida, representacion del conocimiento, redes y graficos, y optimizacion aplicada.;https://www.educations.com/study-abroad/university-of-rovira-i-virgili/inter-university-masters-degree-in-computational-engineering-and-mathematics-1425625
Transcripciones/educations.comstudy/Pagina14.txt.csv;Diseno MA 3D para entornos virtuales;Glasgow;Maestria;Glasgow Caledonian University;El programa MA 3D Design for Virtual Environments esta orientado hacia las necesidades industriales, la tecnologia y la practica actuales y esta destinado a proporcionar a los estudiantes las habilidades clave necesarias para desarrollar la competencia practica y teorica en cualquier area especializada de animacion 3D.;https://www.educations.com/study-abroad/glasgow-caledonian-university/ma-3d-design-for-virtual-environments-159119
Transcripciones/educations.comstudy/Pagina15.txt.csv;Maestria en Ciberseguridad;Estocolmo;Maestria;KTH Royal Institute of Technology;El programa de maestria en Ciberseguridad brinda a los estudiantes acceso a todos los cursos que ofrece la facultad en ciberseguridad en KTH. El programa comienza con cursos obligatorios que brindan una descripcion general del campo, con un curso en, por ejemplo, pirateria etica, y una base solida en el pilar de seguridad fundamental de la criptografia.;https://www.educations.com/study-abroad/kth-royal-institute-of-technology/masters-in-cybersecurity-1593246
Transcripciones/educations.comstudy/Pagina16.txt.csv;Master en Gestion de la Ciberseguridad;Lituania;Maestria;Mykolas Romeris University;El programa Cybersecurity Management es una excelente opcion para estudiar si esta interesado en la proteccion de los datos, la infraestructura critica y las fuentes de informacion, si cree en la creciente necesidad de una gestion eficaz de los datos, los procesos de seguridad, los recursos humanos y la creciente demanda de ciberseguridad;https://www.educations.com/study-abroad/mykolas-romeris-university/master-in-cybersecurity-management-1523539
Transcripciones/educations.comstudy/Pagina17.txt.csv;Master en linea en gestion de blockchain;Virtual;Maestria;GBSB Global Business School;El plan de estudios de la Maestria en linea en gestion de cadenas de bloques de GBSB Global ofrece informacion detallada y un dominio completo de los fundamentos de la cadena de bloques, al mismo tiempo que ayuda a los estudiantes a convertirse en analistas criticos de los procesos, practicas y herramientas que implica esta tecnologia innovadora;https://www.educations.com/study-abroad/gbsb-global-business-school/online-master-in-blockchain-management-1578010
Transcripciones/educations.comstudy/Pagina18.txt.csv;Maestria en Big Data, Marketing y Gestion;Toulouse;Maestria;TBS Education - Toulouse Campus;El Master of Science in Big Data, Marketing & Management (D2M) en Toulouse Business School, tiene como objetivo proporcionar una solida formacion multidisciplinar para ayudar a equipar a los estudiantes con las habilidades necesarias para resolver los problemas de marketing de hoy y convertirse en una parte esencial de su futuro. proceso de toma de decisiones de las empresas.;https://www.educations.com/study-abroad/tbs-education-tbs-group/tbs-education-toulouse-campus/msc-big-data-marketing-and-management-1413043
Transcripciones/educations.comstudy/Pagina19.txt.csv;Master Erasmus Mundus en Gestion y Analisis de Big Data (BDMA);Barcelona;Maestria;Universitat Politecnica de Catalunya;El master Erasmus Mundus en Big Data Management and Analytics (BDMA) proporciona a los estudiantes la formacion integral necesaria para que comprendan, aprendan y adquieran habilidades de BI y desarrollen estrategias de toma de decisiones para los negocios.;https://www.educations.com/study-abroad/universitat-politecnica-de-catalunya/erasmus-mundus-master-in-big-data-management-and-analytics-bdma-1498678
Transcripciones/educations.comstudy/Pagina20.txt.csv;Master en Infografia, Juegos y Realidad Virtual;Mostoles;Maestria;Rey Juan Carlos University;Adecuar la formacion del alumno a las necesidades que encontrara al desarrollar aplicaciones o investigar en esta area, lo que requiere tener en cuenta materias que incluyen fundamentos, metodologias, tecnologias, aplicaciones, etc.;https://www.educations.com/study-abroad/rey-juan-carlos-univesity/master-in-computer-graphics-games-and-virtual-reality-1033162
Transcripciones/portal.icetex.gov.coPor/Pagina21.txt.csv;Estudios de Doctorado en diferentes areas en Rusia;Rusia;Doctorado;Gobierno de la Federacion de Rusia;Ofrecer la oportunidad a profesionales colombianos de realizar sus estudios de doctorado en Universidades de la Federacion de Rusia.;https://portal.icetex.gov.co/Portal/Home/HomeEstudiante/becas/becas-para-estudios-en-el-exterior/becas-vigentes/gdes-estudios-doctorado-diferentes-areas-rusia/
Transcripciones/portal.icetex.gov.coPor/Pagina22.txt.csv;Maestrias en diferentes areas en Rusia;Rusia;Maestria;Gobierno de la Federacion de Rusia;Ofrecer la oportunidad a profesionales colombianos de realizar sus estudios de maestria en universidades de la Federacion de Rusia.;https://portal.icetex.gov.co/Portal/Home/HomeEstudiante/becas/becas-para-estudios-en-el-exterior/becas-vigentes/gdes-maestria-diferentes-areas-rusia
Transcripciones/buildyourfuture.withgoog/Pagina23.txt.csv;Beca Generation Google: para mujeres en informatica;Europa, Medio Oriente y africa;Pregrado / Licenciatura, Maestria, Doctorado;Google;La Beca Generation Google: para mujeres en ciencias de la computacion se establecio para ayudar a las aspirantes a informaticas a sobresalir en tecnologia y convertirse en lideres en el campo;https://buildyourfuture.withgoogle.com/scholarships/generation-google-scholarship-emea/
Transcripciones/becas-sin-fronteras.com/Pagina24.txt.csv;Beca para maestria en Ciberseguridad en Arabia Saudita;Arabia Saudi;Maestria;Universidad Prince Sultan;La Beca para maestria en Ciberseguridad en Arabia Saudita,  es convocada por la Universidad Prince Sultan y se dirige a jovenes estudiantes interesados en capacitarse en areas como, desarrollo de sistemas anti-drones, sistemas aereos no tripulados, internet de las cosas, etc.;https://becas-sin-fronteras.com/beca/beca-para-maestria-en-ciberseguridad-en-arabia-saudita-a2104/
Transcripciones/becas-sin-fronteras.com/Pagina25.txt.csv;Becas Facebook Fellowship Program;Alemania, Argentina, Brasil, Espana, Paises Bajos, entre otros;Doctorado;Fundacion Becas Facebook;Facebook es una de las plataformas con mayor reconocimiento mundial, permitiendo que la Fundacion de financiacion de becas de doctorado a nivel mundial cuente con gran respeto de entidades y organizaciones de anos de experiencia en el area de educacion superior.;https://becas-sin-fronteras.com/beca/becas-facebook-fellowship-program-a1036/
Transcripciones/graduate2.korea.ac.krgr/Pagina26.txt.csv;Becas KU;Corea;Maestria, Doctorado;Universidad de Corea;Alrededor del 80% de todos los estudiantes internacionales admitidos recibiran becas. Los estudiantes internacionales pueden solicitar esta beca cuando soliciten la admision a la Universidad de Corea;https://graduate2.korea.ac.kr/gradeng/scholarships.do
Transcripciones/grants.aten=MzM5MzhfM/Pagina27.txt.csv;Becas de excelencia de maestria para estudiantes en informatica;Austria;Maestria;Siemens Aktiengesellschaft Asterreich and TU Graz;Junto con la Universidad de Tecnologia de Graz, Siemens T UR (Relaciones con la Universidad de Tecnologia) otorga dos becas para estudiantes talentosos y capaces en el programa de maestria para cientificos informaticos.;https://grants.at/en/?=MzM5MzhfMzU3NThfNjE=
Transcripciones/tugraz.atenstudyin/Pagina28.txt.csv;Becas de maestria de excelencia para estudiantes en informatica;Austria;Maestria;Siemens Aktiengesellschaft Asterreich and TU Graz;Dos Siemens Las becas se otorgaran a estudiantes de maestria en la Ciencia de la Computacion,Ingenieria de Software y Gestion, de la Informacion y de Ingenieria Informatica de programas;https://www.tugraz.at/en/studying-and-teaching/studying-at-tu-graz/prospective-students/financial-matters/scholarships-for-students/siemens-scholarships/
Transcripciones/portal.icetex.gov.coPor/Pagina29.txt.csv;Programas de Maestria en la Universidad Internacional de la Rioja;Virtual;Maestria;Universidad Internacional de La Rioja;La Universidad Internacional de La Rioja otorgar 36 becas de posgrado a nivel de Maestria a profesionales universitarios en todo el pais. El aspirante tendra la posibilidad de postularse a uno de los 91 programas de maestria oficiales relacionados en esta convocatoria.;https://portal.icetex.gov.co/Portal/Home/HomeEstudiante/becas/becas-para-estudios-en-el-exterior/becas-vigentes/programas-de-maestria-en-la-universidad-internacional-de-la-rioja
Transcripciones/colombia.unir.netingeni/Pagina30.txt.csv;Master Universitario en Ingenieria del Software y Sistemas Informaticos;Virtual;Maestria;Universidad Internacional de La Rioja;La maestria en Ingenieria de Software tiene como objetivo completar la formacion de los profesionales TI y dotarles de conocimientos sobre desarrollo web, ciberseguridad e ingenieria de softwar;https://colombia.unir.net/ingenieria/maestria-ingenieria-software/
Transcripciones/colombia.unir.netingeni/Pagina31.txt.csv;Master Universitario en Inteligencia Artificial;Virtual;Maestria;Universidad Internacional de La Rioja;La Maestria en Inteligencia Artificial es el unico posgrado oficial con docencia 100% virtual, que dota al alumno de los conocimientos tecnicos y practicos necesarios para lograr el comportamiento inteligente de las maquinas.;https://colombia.unir.net/ingenieria/maestria-inteligencia-artificial/
Transcripciones/colombia.unir.netingeni/Pagina32.txt.csv;Master Universitario en Seguridad Informatica;Virtual;Maestria;Universidad Internacional de La Rioja;La Maestria en Seguridad Informatica de UNIR es la primera maestria oficial con docencia 100% virtual que tiene como objetivo formarte en las principales tecnicas de proteccion¿ frente a ataques y amenazas en sistemas operativos, redes, software de aplicacion, sistemas web y bases de datos.;https://colombia.unir.net/ingenieria/maestria-seguridad-informatica/
Transcripciones/colombia.unir.netingeni/Pagina33.txt.csv;Master Universitario en Analisis y Visualizacion de Datos Masivos (Visual Analytics and Big Data);Virtual;Maestria;Universidad Internacional de La Rioja;La Maestria en Ciencia de Datos virtual te forma como un profesional del Big Data con un alto dominio en cuatro aspectos clave como son las infraestructuras para el almacenamiento y procesamiento distribuido del dato,mineria de datos para aplicar metodos de inteligencia artificial, aprendizaje automatico y estadistica sobre grandes volumenes de datos;https://colombia.unir.net/ingenieria/maestria-visual-analytics-big-data/
Transcripciones/colombia.unir.netingeni/Pagina34.txt.csv;Master Universitario en Internet de las Cosas (IoT);Virtual;Maestria;Universidad Internacional de La Rioja;La Maestria en Internet de las Cosas de UNIR tiene como objetivo formarte para ser capaz de comprender las caracteristicas y las necesidades de las soluciones tecnologicas empresariales reales y aplicables de Internet de las Cosas con plataformas punteras, como Google Cloud IoT y Microsoft Azure IoT y de liderar proyectos para su implantacion en la empresa.;https://colombia.unir.net/ingenieria/maestria-internet-de-las-cosas-iot/
Transcripciones/portal.icetex.gov.coPor/Pagina35.txt.csv;Maestria en diferentes areas en China;China;Maestria;Gobierno de la Republica Popular China;Se ofrece la oportunidad a profesionales colombianos de realizar estudios de maestria en diferentes areas, en universidades y centros de ensenanza superior en China.;https://portal.icetex.gov.co/Portal/Home/HomeEstudiante/becas/becas-para-estudios-en-el-exterior/becas-vigentes/gdes-maestria-diferentes-areas-china/
Transcripciones/portal.icetex.gov.coPor/Pagina36.txt.csv;Doctorados en diferentes areas en China;China;Doctorado;Gobierno de la Republica Popular China;Se ofrece la oportunidad a profesionales colombianos de realizar estudios de doctorado en diferentes areas, en universidades y centros de ensenanza superior en China.;https://portal.icetex.gov.co/Portal/Home/HomeEstudiante/becas/becas-para-estudios-en-el-exterior/becas-vigentes/conv-doctorados-diferentes-areas-china/
Transcripciones/portal.icetex.gov.coPor/Pagina37.txt.csv;Maestrias en diferentes areas;Virtual;Maestria;Atlantis University;Brindar a los participantes la oportunidad de realizar estudios de Maestria en diferentes areas en Atlantis University.;https://portal.icetex.gov.co/Portal/Home/HomeEstudiante/becas/becas-para-estudios-en-el-exterior/becas-vigentes/generalidades-maestrias-en-diferentes-areas/
Transcripciones/portal.icetex.gov.coPor/Pagina38.txt.csv;Maestrias en diferentes areas en la Universidad Nebrija;Virtual;Maestria;Universidad Nebrija;La Universidad Nebrija ofrece a profesionales colombianos la oportunidad de realizar estudios virtuales de maestria con titulacion oficial en diferentes areas.;https://portal.icetex.gov.co/Portal/Home/HomeEstudiante/becas/becas-para-estudios-en-el-exterior/becas-vigentes/generalidades-maestrias-en-diferentes-areas-en-la-universidad-nebrija/
Transcripciones/becas-sin-fronteras.com/Pagina39.txt.csv;Becas Chevening Reino Unido;Reino Unido;Maestria;Oficina de Relaciones Exteriores del Reino Unido, Commonwealth, Oficina de Desarrollo y varias organizaciones asociadas;La Beca Chevening es una beca internacional que habilita al alumnado con capacidades de liderazgo de 144 paises para realizar estudios de posgrado o cursos en universidades en el Reino Unido.;https://becas-sin-fronteras.com/beca/becas-chevening-reino-unido-a0978/
Transcripciones/maastrichtuniversity/Pagina40.txt.csv;Beca de alto potencial de Paises Bajos de la Universidad de Maastricht;Paises Bajos;Maestria;Maastricht University Holland;El programa de becas consta tanto de la beca High Potential Scholarship (financiada por el Fondo de becas de la Universidad de Maastricht) como de la Holland Scholarship, que esta financiada por el Ministerio de Educacion, Cultura y Ciencia holandas en conjunto con universidades holandesas y universidades de ciencias aplicadas. Esta dirigido a estudiantes internacionales de fuera de la UE / EEE que deseen seguir un programa de grado completo en los Paises Bajos.;https://www.maastrichtuniversity.nl/support/your-studies-begin/coming-maastricht-university-abroad/scholarships/maastricht-university
Transcripciones/ox.ac.ukadmissions/Pagina41.txt.csv;Maestria en Ciencias de la Computacion Avanzada;Reino Unido;Maestria;Universidad de Oxford;La Maestria en Ciencias de la Computacion Avanzada en Oxford ha sido disenada para ensenar una variedad de temas avanzados a graduados de ciencias de la computacion y otras disciplinas matematicas.;https://www.ox.ac.uk/admissions/graduate/courses/msc-advanced-computer-science
Transcripciones/ox.ac.ukadmissions/Pagina42.txt.csv;Maestria en software y seguridad de sistemas;Reino Unido;Maestria;Universidad de Oxford;La Maestria en Software y Seguridad de Sistemas ensena los principios de seguridad de sistemas, con un enfasis particular en las propiedades de seguridad y las implicaciones del software y las tecnologias de la informacion.;https://www.ox.ac.uk/admissions/graduate/courses/msc-software-and-systems-security
Transcripciones/qutech.nlacademyjoins/Pagina43.txt.csv;Becas QuTech para estudiantes internacionales de maestria;Virtual;Maestria;QuTech;QuTech ofrece becas para solicitantes internacionales excelentes interesados ??en una carrera de maestria en cuantica. Por ano, QuTech ofrece 6 becas completas, dos para cada division:Qubit Research , Quantum Internet y Quantum Computing. Cuando un estudiante completa el programa de maestria y recibe un 9 (90%) o mas para el proyecto de tesis de maestria, se le ofrecera un puesto de doctorado en la misma hoja de ruta.;https://qutech.nl/academy/join/scholarships/?cn-reloaded=1
Transcripciones/study.buenosaires.gob.ar/Pagina44.txt.csv;Becas Study Buenos Aires;Buenos Aires;Maestria, Especializacion, Doctorado;Gobierno de la Ciudad de Buenos Aires, Provincia de Buenos Aires y 19 Universidades de la Ciudad de Buenos Aires;Se brindan 46 becas para que los/as seleccionados/as puedan realizar una Especializacion, Maestria, o Doctorado en alguna de las universidades con las que Study Buenos Aires tiene convenio. El programa brinda la posibilidad de aplicar a un posgrado y obtener una beca academica completa, teniendo 100% cubierto el valor de la matricula y los aranceles del posgrado. Hay una oferta disponible de 159 programas distribuidos en 13 areas de conocimiento diferentes.;https://study.buenosaires.gob.ar/es/articulos/view/Noticias/73
Transcripciones/shu.ac.ukInternatio/Pagina45.txt.csv;Becas Transform Together;Inglaterra;Pregrado / Licenciatura, Maestria, Doctorado;Sheffield Hallam University;Las becas Transform Together son exclusivamente para estudiantes internacionales que comienzan un curso impartido a tiempo completo en 2021-22. Una exencion de la mitad de la tarifa (50% de descuento) esta disponible para cursos impartidos de pregrado y posgrado durante el primer ano de estudio.;https://www.shu.ac.uk/International/Fees-scholarships-and-discounts/Scholarships-discounts-and-bursaries/Transform-Together-Scholarships
Transcripciones/oij.orgbecas-oij-eadic-/Pagina46.txt.csv;Becas OIJ y EADIC;Virtual;Maestria;EADIC;EADIC¿ aporta al Organismo internacional de Juventud becas al 60% para apoyar la labor de integracion y desarrollo de las juventudes del espacio Iberoamericano dando acceso a la formacion superior;https://oij.org/becas-oij-eadic-octubre-2021/
Transcripciones/scholarshipsads.com/Pagina47.txt.csv;Becas De Ciencias De La Computacion Donald Davies En La Universidad Royal Holloway De Londres;Reino Unido;Pregrado / Licenciatura;Royal Holloway University of London;Las becas de Ciencias de la Computacion Donald Davies en la Universidad Royal Holloway de Londres, Reino Unido estan abiertas para estudiantes internacionales. La beca permite programas de nivel universitario en el campo de la informatica que se imparten en la Universidad Royal Holloway de Londres.;https://www.scholarshipsads.com/donald-davies-computer-science-scholarships-at-royal-holloway-university-of-london-uk-2022-23/
Transcripciones/sfs.opm.govStudDefa/Pagina48.txt.csv;Programa SFS;Estados Unidos;Pregrado / Licenciatura, Maestria, Doctorado;CyberCorps Scholarship for Service;Los programas de estudio son variados y cubren campos como Ciencias de la Computacion / Ingenieria, Seguridad de las Tecnologias Emergentes (por ejemplo, Internet de las cosas, implantes medicos), Ciber-Derecho y Privacidad, y Politica.;https://www.sfs.opm.gov/StudDefault.aspx
